{"schema_version":"2.2.0","document_id":"doc_x655ctkrq7d1qhgpprc0y8fbmq","query":"What evidence supports this result?","top_k":5,"auth":{"event_id":"ffffffffffffffffffffffffffffffffffffffffffffffffffffffffffffffff","principal_id":"aaaaaaaaaaaaaaaaaaaaaaaaaaaaaaaaaaaaaaaaaaaaaaaaaaaaaaaaaaaaaaaa","method":"POST","url":"/v2/knowledge_search_v2","created_at":1780000000,"expires_at":1780000060,"payload_canonicalization":"rfc8785-json-excluding-auth","payload_sha256":"1111111111111111111111111111111111111111111111111111111111111111","collection":"nanolime"}}
